{
  "project": {
    "name": "Memos",
    "repository_url": "https://github.com/usememos/memos",
    "description": "Self-hosted note-taking app built for quick capture, markdown-native, with the data staying under the user's control.",
    "kind": "Self-hosted web application",
    "primary_languages": [
      "Go",
      "TypeScript"
    ],
    "stats": {
      "approx_source_files": 948,
      "top_level_dirs": [
        "cmd",
        "docs",
        "internal",
        "proto",
        "scripts",
        "server",
        "store",
        "web"
      ]
    }
  },
  "components": [
    {
      "id": "web",
      "parent_id": null,
      "name": "Memo Editor",
      "purpose": "The writing surface: markdown editing with autocomplete, syntax highlighting and attachments.",
      "importance": "high",
      "type": "frontend",
      "tech": [
        "TypeScript",
        "CSS",
        "HTML"
      ],
      "files": [
        "web/src/components/MemoEditor/index.tsx",
        "web/src/components/MemoEditor/Toolbar/index.ts",
        "web/src/components/MemoEditor/Editor/index.tsx",
        "web/src/components/MemoEditor/Editor/controller.ts",
        "web/src/components/MemoEditor/Editor/extensions.ts"
      ],
      "file_count": 5
    },
    {
      "id": "store",
      "parent_id": null,
      "name": "Data Storage",
      "purpose": "Handles data storage and retrieval for the application.",
      "importance": "high",
      "type": "backend",
      "tech": [
        "Go",
        "SQL"
      ],
      "files": [
        "store/db/mysql/attachment.go",
        "store/cache/cache.go",
        "store/db/postgres/idp.go"
      ],
      "file_count": 3
    },
    {
      "id": "server",
      "parent_id": null,
      "name": "Server Backend",
      "purpose": "Provides the server-side logic and API for the application.",
      "importance": "high",
      "type": "backend",
      "tech": [
        "Go",
        "Protocol Buffers"
      ],
      "files": [
        "server/router/api/v1/memo_service.go",
        "server/runner/s3presign/runner_test.go",
        "proto/gen/store/idp.pb.go",
        "store/db/sqlite/reaction.go",
        "proto/gen/api/v1/user_service_grpc.pb.go"
      ],
      "file_count": 5
    },
    {
      "id": "auth",
      "parent_id": null,
      "name": "Authentication",
      "purpose": "Handles user authentication and authorization.",
      "importance": "high",
      "type": "backend",
      "tech": [
        "JWT (JSON Web Tokens)",
        "gRPC"
      ],
      "files": [
        "server/auth/extract.go",
        "store/cache/cache_test.go",
        "server/router/mcp/service_test.go"
      ],
      "file_count": 3
    },
    {
      "id": "data",
      "parent_id": null,
      "name": "Data Management",
      "purpose": "Manages data migrations and schema changes.",
      "importance": "high",
      "type": "backend",
      "tech": [
        "Go",
        "SQL"
      ],
      "files": [
        "proto/gen/api/v1/user_service_grpc.pb.go",
        "store/cache/cache_test.go"
      ],
      "file_count": 2
    },
    {
      "id": "internal",
      "parent_id": null,
      "name": "Internal Services",
      "purpose": "Contains internal services and utilities for the application.",
      "importance": "high",
      "type": "backend",
      "tech": [
        "Go",
        "gRPC"
      ],
      "files": [
        "internal/ai/stt/openai/openai.go",
        "store/cache/cache_test.go"
      ],
      "file_count": 2
    },
    {
      "id": "web.editor",
      "parent_id": "web",
      "name": "Memo Editor Components",
      "purpose": "Components for the memo editor, including preview and sharing.",
      "importance": "high",
      "type": "frontend",
      "tech": [
        "TypeScript",
        "CSS",
        "HTML"
      ],
      "files": [
        "web/src/components/MemoEditor/Toolbar/index.ts",
        "web/src/components/MemoEditor/Editor/extensions.ts"
      ],
      "file_count": 2
    },
    {
      "id": "internal.ai",
      "parent_id": "internal",
      "name": "AI Services",
      "purpose": "Contains AI-related services and models.",
      "importance": "high",
      "type": "backend",
      "tech": [
        "Go",
        "gRPC"
      ],
      "files": [
        "internal/ai/stt/openai/openai.go",
        "store/cache/cache_test.go"
      ],
      "file_count": 2
    },
    {
      "id": "internal.email",
      "parent_id": "internal",
      "name": "Email Services",
      "purpose": "Handles email-related functionalities.",
      "importance": "high",
      "type": "backend",
      "tech": [
        "Go",
        "gRPC"
      ],
      "files": [
        "internal/email/client.go",
        "store/cache/cache_test.go"
      ],
      "file_count": 2
    },
    {
      "id": "web.editor.preview",
      "parent_id": "web.editor",
      "name": "Memo Editor Preview",
      "purpose": "Provides a preview of the memo editor content.",
      "importance": "medium",
      "type": "frontend",
      "tech": [
        "TypeScript",
        "CSS",
        "HTML"
      ],
      "files": [
        "web/src/components/MemoEditor/Toolbar/index.ts",
        "web/src/components/MemoEditor/Editor/extensions.ts"
      ],
      "file_count": 2
    }
  ],
  "relationships": [
    {
      "from": "web.editor.preview",
      "to": "web.editor",
      "type": "uses",
      "because": [
        "PreviewImageDialog.tsx"
      ]
    },
    {
      "from": "internal.ai",
      "to": "server",
      "type": "uses",
      "because": [
        "ai_service.go",
        "ai_service.pb.gw.go"
      ]
    },
    {
      "from": "web.editor.preview",
      "to": "store",
      "type": "uses",
      "because": [
        "deriveDefaultCreateTime.ts"
      ]
    },
    {
      "from": "internal.email",
      "to": "server",
      "type": "uses",
      "because": [
        "email_service.go",
        "email_service.pb.gw.go"
      ]
    }
  ],
  "suggested_questions": [
    "What is the main purpose of the Memo Editor component?",
    "How does the application handle user authentication and authorization?",
    "Can you explain how data migrations are managed in the project?",
    "Which services are responsible for handling AI-related functionalities?",
    "Where can I find the code that handles email functionality within the project?"
  ]
}
